<?xml version="1.0" encoding="UTF-8" standalone="no"?>
<gyogyszertar_adatok
	xmlns:xsi="http://www.w3.org/2001/XMLSchema-instance"
	xsi:noNamespaceSchemaLocation="XMLSchemaA97C75.xsd">

	<raktarak>
		<raktar RID="1">
			<cim>
				<iranyitoszam>3526</iranyitoszam>
				<varos>Miskolc</varos>
				<utca>Szentpéteri kapu</utca>
				<hazszam>47</hazszam>
			</cim>
			<nev>The Storage</nev>
		</raktar>
		<raktar RID="3">
			<cim>
				<iranyitoszam>3529</iranyitoszam>
				<varos>Miskolc</varos>
				<utca>Szentgyörgy út</utca>
				<hazszam>10</hazszam>
			</cim>
			<nev>MedStor</nev>
		</raktar>
	</raktarak>

	<gyogyszertarak>
		<gyogyszertar GysztID="12">
			<cim>
				<iranyitoszam>3526</iranyitoszam>
				<varos>Miskolc</varos>
				<utca>Szentpéteri kapu</utca>
				<hazszam>72-76</hazszam>
			</cim>
			<nev>Szent Péter gyógyszertár</nev>
		</gyogyszertar>
		<gyogyszertar GysztID="4">
			<cim>
				<iranyitoszam>3529</iranyitoszam>
				<varos>Miskolc</varos>
				<utca>Szentgyörgy út</utca>
				<hazszam>25</hazszam>
			</cim>
			<nev>Benu gyógyszertár</nev>
		</gyogyszertar>
	</gyogyszertarak>

	<gyogyszertarvezetok>
		<gyogyszertarvezeto GyvID="KP13">
			<cim>
				<iranyitoszam>3526</iranyitoszam>
				<varos>Miskolc</varos>
				<utca>Katowice</utca>
				<hazszam>14</hazszam>
			</cim>
			<nev>Dr. Kalapos Péter</nev>
		</gyogyszertarvezeto>
		<gyogyszertarvezeto GyvID="FZ02">
			<cim>
				<iranyitoszam>3529</iranyitoszam>
				<varos>Miskolc</varos>
				<utca>Áfonyás utca</utca>
				<hazszam>25</hazszam>
			</cim>
			<nev>Dr. Fekete Zoltán</nev>
		</gyogyszertarvezeto>
	</gyogyszertarvezetok>

	<dolgozok>
		<dolgozo DID="MF12">
			<cim>
				<iranyitoszam>3526</iranyitoszam>
				<varos>Miskolc</varos>
				<utca>Gömöri tér</utca>
				<hazszam>8</hazszam>
			</cim>
			<nev>Molnár Ferenc</nev>
		</dolgozo>
		<dolgozo DID="SM02">
			<cim>
				<iranyitoszam>3525</iranyitoszam>
				<varos>Miskolc</varos>
				<utca>Galagonyás sor</utca>
				<hazszam>1</hazszam>
			</cim>
			<nev>Soós Márton</nev>
		</dolgozo>
	</dolgozok>

	<gyogyszerek>
		<gyogyszer GyszID="6318">
			<receptre_kaphato>Nem</receptre_kaphato>
			<hatoanyag>metamizol-nátrium</hatoanyag>
			<tipus>fájdalom- és lázcsillapító, gyulladáscsökkentő</tipus>
			<nev>Algopyrin</nev>
		</gyogyszer>
		<gyogyszer GyszID="8113">
			<receptre_kaphato>Nem</receptre_kaphato>
			<hatoanyag>magnézium</hatoanyag>
			<tipus>Vitamin</tipus>
			<nev>Magnerot</nev>
		</gyogyszer>
	</gyogyszerek>

	<vasarlok>
		<vasarlo VID="983323">
			<nev>Hajdu Gábor</nev>
			<haziorvos>Dr. Lóránt Tibor</haziorvos>
			<gyogyszererzekenyseg>nincs</gyogyszererzekenyseg>
		</vasarlo>
		<vasarlo VID="64531">
			<nev>Horvát Róbert</nev>
			<haziorvos>Dr. Kovács Péter</haziorvos>
			<gyogyszererzekenyseg>metamizol-nátrium</gyogyszererzekenyseg>
		</vasarlo>
	</vasarlok>

	<gyogyszertar-raktar>
		<szallitas>
			<datum>2020-12-03</datum>
			<fuvarozo_ceg>DHL</fuvarozo_ceg>
			<osszeg>456000</osszeg>
			<GysztID>12</GysztID>
			<RID>1</RID>
		</szallitas>
		<szallitas>
			<datum>2020-11-10</datum>
			<fuvarozo_ceg>GLS</fuvarozo_ceg>
			<osszeg>123000</osszeg>
			<GysztID>4</GysztID>
			<RID>10</RID>
		</szallitas>
	</gyogyszertar-raktar>

	<gyogyszertar-vasarlo>
		<vasarlas>
			<osszeg>5300</osszeg>
			<fizetesi_mod>Bankkártya</fizetesi_mod>
			<GysztID>12</GysztID>
			<VID>983323</VID>
		</vasarlas>
		<vasarlas>
			<osszeg>12340</osszeg>
			<fizetesi_mod>Készpénz</fizetesi_mod>
			<GysztID>4</GysztID>
			<VID>64531</VID>
		</vasarlas>
	</gyogyszertar-vasarlo>

	<vasarlo-gyogyszer>
		<betegseg>
			<panasz>nincs</panasz>
			<VID>64531</VID>
			<GyszID>8113</GyszID>
		</betegseg>
		<betegseg>
			<panasz>fejfájás, láz</panasz>
			<VID>983323</VID>
			<GyszID>6318</GyszID>
		</betegseg>
	</vasarlo-gyogyszer>

	<gyogyszertar-gyogyszertarvezeto>
		<vezetes>
			<GyvID>KP13</GyvID>
			<GysztID>12</GysztID>
		</vezetes>
		<vezetes>
			<GyvID>FZ02</GyvID>
			<GysztID>4</GysztID>
		</vezetes>
	</gyogyszertar-gyogyszertarvezeto>

	<dolgozo-gyogyszertarvezeto>
		<alkalmazott>
			<GyvID>KP13</GyvID>
			<DID>MF12</DID>
		</alkalmazott>
		<alkalmazott>
			<GyvID>FZ02</GyvID>
			<DID>SM02</DID>
		</alkalmazott>
	</dolgozo-gyogyszertarvezeto>

</gyogyszertar_adatok>